Nombre,Marca,Precio
Repelente de insectos Stay OFF! para Niños en Spray 120ml,Stay Off,22500
Detergente Líquido Ariel Doble Poder Concentrado 1200 Ml,Ariel,22690
Repelente Raid para Insectos Voladores Und + Repuesto 65g,Raid,22300
"Detergente Ariel Triple Poder en Polvo 2,2 Kg",Ariel,25990
Lavaplatos en Crema Axion Limon 450g x 2und,Axion,9990
Suavizante Suavitel Cuidado Superior Fresca Primavera 2x 1L,Suavitel,14990
Servilleta Olimpica Doble Faz X180 Unds,Olimpica,3500
Papel Higiénico Familia Expert 26 Mts X9 Rollos,Familia,21000
Blanqueador Clorox Original Botella 3.8 lt,Clorox,10990
Detergente Polvo Fab Ultra flash 2 Kg,Fab,23332
Papel Higiénico Scott Doble Higiene Doble Hoja 16 Rollos,Scott,14990
"Papel Higiénico Familia Acolchamax Mega Rollo 29,6 Mts X12 Unds",Familia,27800
Suavizante Suavitel Cuidado Superior Fresca Primavera 2.8L x2und,Suavitel,37990
Limpia Pisos Fabuloso Antibacterial Lavanda 2L,Fabuloso,13990
Detergente en Polvo Ariel Triple Poder 5kg Jabon para Ropa,Ariel,51990
PAPEL HIGIENICO SUPPRA CARE TRIP HOJ 33 M X12 ROLL,Suppra Care,13950
Suavizante Suavitel Cuidado Superior Fresca Primavera 2.3L,Suavitel,18315
Detergente Líquido UltraLimp Floral 4000 Ml,Ultralimp,15990
Lavaplatos Liquido Axion Limon 750ml,Axion,11340
Repelente de insectos Stay OFF! para Niños en Spray 120ml,Stay Off,22500
Detergente Líquido Ariel Doble Poder Concentrado 1200 Ml,Ariel,22690
Repelente Raid para Insectos Voladores Und + Repuesto 65g,Raid,22300
"Detergente Ariel Triple Poder en Polvo 2,2 Kg",Ariel,25990
Toalla de Cocina Olimpica Triple Hoja X100 Uds,Olimpica,5290
Detergente Líquido Dersa Rey 4000 Ml,Dersa,41850
Servilleta Familia Acolchamax Mediana X100 Unds,Familia,3990
Bolsa de Basura Ultralimp para Papelera 43x48 Cm X30 Unds,Ultralimp,2980
Toalla de Cocina Ultralimp Doble Hoja X80 Hojas,Ultralimp,2650
Limpia Pisos Ajax Bicarbonato Naranja-Limón 2L - Limpieza Profunda,Ajax,15990
Bolsa de Basura Ultralimp Negra 65x90 Cm X10 Unds,Ultralimp,2890
Blanqueador UltraLimp Desinfectante 2000 Ml,Ultralimp,2800
Papel Higienico Suave Gold Triple Hoja 32 Mts X12 Unds,Suave,35290
Limpia Pisos Fabuloso Antibacterial Lavanda 1L,Fabuloso,9450
Lava Platos Líquido Ultralimp Limón 1 L,Ultralimp,5190
BSA BASURA TASK BIORILLO 80X100cm X10 un,Task,14450
"Detergente Polvo UltraLimp Aloe Bicarbonato 2,5Kg",Ultralimp,8850
PAPEL HIGIÉNICO ROSAL 3P PLUS MEGA PACK 20M X15R,Rosal,15990
Bolsa Compostable No 6 30x55 Cm,Sin Marca,520
Repelente de insectos Stay OFF! para Niños en Spray 120ml,Stay Off,22500
Detergente Líquido Ariel Doble Poder Concentrado 1200 Ml,Ariel,22690
Repelente Raid para Insectos Voladores Und + Repuesto 65g,Raid,22300
"Detergente Ariel Triple Poder en Polvo 2,2 Kg",Ariel,25990
Detergente Líquido UltraLimp Lavanda 4000 Ml,Ultralimp,15990
"Quita Manchas Clorox Ropa 4 En 1 Para Ropa De Color Sin Cloro 1,8 Lt",Clorox,10990
Lavaplatos Liquido Axion Limon 1.5L,Axion,15030
L/LOZA LIQ DERSA LIMON 4L,Dersa,28800
Bolsa de Basura Ultralimp Negra 51x75 Cm X10 Unds,Ultralimp,1900
BSA BASURA TASK 70X90 X20un,Task,14500
Detergente Líquido Woolite Ropa oscura 1800 Ml,Woolite,23512
DETERG LIQ DERSA 50 LAVADAS 4L,Dersa,41850
Detergente Líquido Woolite Protección y Cuidado 1800 Ml,Woolite,25720
Suavizante Dersa Manzana Verde 4000 Ml,Dersa,24600
Detergente Líquido Dersa Manzana 4000 Ml,Dersa,41850
Detergente Polvo Fab Ultra flash 5 Kg,Fab,47591
Lavaplatos Líquido Axion Limón 2.3L - Poder Desengrasante,Axion,24200
Jabón Único Plus 250 G X3 Unda,Unico,6490
Repelente de insectos Stay OFF! para Niños en Spray 120ml,Stay Off,22500
Detergente Líquido Ariel Doble Poder Concentrado 1200 Ml,Ariel,22690
Repelente Raid para Insectos Voladores Und + Repuesto 65g,Raid,22300
"Detergente Ariel Triple Poder en Polvo 2,2 Kg",Ariel,25990
Blanqueador Blancox Desinfectante Poder Natural 2000 Ml,Blancox,6490
Desmanchador Blancox Ropa Color Sin Cloro 2000 Ml + Gratis 1000 Ml,Blancox,17990
Quitamanchas Vanish polvo rosa 120g,Vanish,7120
Servilleta Familia Expert X150 Unds,Familia,9490
Quitamanchas Vanish líquido Rosa 1.8L + 800ml,Vanish,19520
Servilleta Familia Acolchamax Mediana X300 Unds,Familia,10490
Limpia Pisos Ajax Naranja Limon 1L,Ajax,10395
Quitamanchas Vanish líquido Rosa 1.8L Botella,Vanish,19320
Detergente Polv Ak 1 Floral 3000 G,Azul K,23400
Quitamanchas Vanish polvo blanco 120g,Vanish,7168
Blanqueador Clorox Original 1800 Ml + Blanqueador Original 460 Ml,Clorox,7990
Quitamanchas Vanish líquido blanco 900ml,Vanish,10720
Suavizante Suavitel Complete Fresca Primavera 1.3L,Suavitel,12990
Quitamanchas Vanish líquido Blanco 1.8L Botella,Vanish,16320
LAVALOZA ULTRALIMP CREM 500G,Ultralimp,2550
Repelente de insectos Stay OFF! para Niños en Spray 120ml,Stay Off,22500
Detergente Líquido Ariel Doble Poder Concentrado 1200 Ml,Ariel,22690
Repelente Raid para Insectos Voladores Und + Repuesto 65g,Raid,22300
"Detergente Ariel Triple Poder en Polvo 2,2 Kg",Ariel,25990
Lavaplatos en Crema Axion Avena y Vitamina E 450g x 2und,Axion,13950
Quitamanchas Vanish líquido blanco 800ml,Vanish,7720
Papel Higiénico Scott Cuidado Completo Triple Hoja 30 metros - 12 rollos,Scott,18990
Jabón Supremo Oximax Limón 200 G X3 Unds,Supremo,4990
DETERG LIQ DERSA COCO 4000ML,Dersa,51712
Quitamanchas Vanish líquido rosa 900ml,Vanish,10720
Detergente Polvo Fab Ultra flash 450 G,Fab,5100
Jabón Jirafa Para Lavar 250 G X5 Unds,Jirafa,8990
DETERG LIQ BLANCOX COCO DELI DP X1800ML,Blancox,19990
Quitamanchas Vanish líquido Blanco 1.8L + 800ml,Vanish,19520
Quitamanchas Vanish polvo blanco 900g,Vanish,55840
Detergente Líquido Woolite Protección y Cuidado 900 Ml,Woolite,12872
Detergente Líquido Woolite Bebé 2000 Ml,Woolite,32880
Quitamanchas Vanish polvo blanco 240g,Vanish,14080
Detergente Líquido Top Terra Ecológico 4000 Ml,Top,43725
Repelente de insectos Stay OFF! para Niños en Spray 120ml,Stay Off,22500
Detergente Líquido Ariel Doble Poder Concentrado 1200 Ml,Ariel,22690
Repelente Raid para Insectos Voladores Und + Repuesto 65g,Raid,22300
"Detergente Ariel Triple Poder en Polvo 2,2 Kg",Ariel,25990
"Axion Blue, Lavaplatos Líquido 7 en 1,1.5L",Axion,15990
Quitamanchas Vanish líquido rosa 1.8L,Vanish,16000
Lavaplatos Liquido Axion Limon 720ml,Axion,9090
Detergente Líquido Woolite Ropa Oscura 900 Ml,Woolite,14320
Quitamanchas Vanish polvo Blanco 450g,Vanish,26880
Quitamanchas Vanish líquido Blanco 1.8L,Vanish,16000
Detergente Líquido Woolite Bebé 900 Ml,Woolite,14320
Quitamanchas Vanish polvo rosa 450g,Vanish,29120
Quitamanchas Vanish Prelavado repuesto 500ml,Vanish,13920
Quitamanchas Vanish polvo blanco 850g,Vanish,43800
Multiesponja Bon Bril Super Ahorro X2 Unds,Bon Bril,6990
Plato Rumba Acrilu 23 Cm X12 Unds,Rumba,12300
"LIMPIAD PINOLINA 2 L, CANEL",Pinolina,13990
L/LOZA LIQ SUPREMO 700ML,Supremo,8990
Repelente de insectos Stay OFF! para Niños en Spray 120ml,Stay Off,22500
Detergente Líquido Ariel Doble Poder Concentrado 1200 Ml,Ariel,22690
Repelente Raid para Insectos Voladores Und + Repuesto 65g,Raid,22300
"Detergente Ariel Triple Poder en Polvo 2,2 Kg",Ariel,25990
Quitamanchas Vanish Prelavado Pistola 500ml,Vanish,19680
Quitamanchas Vanish líquido blanco 450ml,Vanish,4760
Q/GRASA SUPREMO D/PACK 500ML,Supremo,5490
Esponja Eterna Doble Acción Máxima Duración 4X2 Unds Oferta,Eterna,6950
PAPEL HIGIENICO SUPPRA CARE BCO ECN 3H 20M X16,Suppra Care,13990
Papel Higiénico Olimpica Triple Hoja 28 Mts X8 Unds,Olimpica,10100
Quitamanchas Vanish líquido rosa 450ml + blanco 450ml,Vanish,4760
BSA BASUR TASK MINI PAPELR 43X48cm X30un,Task,9400
DETERG POLV FAB ULTRA BLANCO 2KG,Fab,25440
Quitamanchas Vanish polvo rosa 900g,Vanish,55840
Quitamanchas Vanish líquido blanco 3785ml,Vanish,34480
P/HIG ROSAL 3P PLUS MEGA PACK 20M X15R,Rosal,15990
Quitamanchas Vanish líquido rosa 3785ml,Vanish,34480
Shampoo Dove Hidra Liso + Hialurónico 400 Ml,Dove,21420
INSECT RAYOL SPRAY MATATOD 400ML X2 P/E,Rayol,22900
Repelente de insectos Stay OFF! para Niños en Spray 120ml,Stay Off,22500
Detergente Líquido Ariel Doble Poder Concentrado 1200 Ml,Ariel,22690
Repelente Raid para Insectos Voladores Und + Repuesto 65g,Raid,22300
"Detergente Ariel Triple Poder en Polvo 2,2 Kg",Ariel,25990
AMBTAD BONAIRE AUT RPT VAI/FLO 250ML X2,Bonaire,30900
Detergente UltraLimp Polvo Floral 4 Kg,Ultralimp,18590
Jabón Dersa Rey 300 G X3 Unds,Rey,10250
BSA BASUR TASK PAPELER 50X55 X20 un,Task,6990
Acondicionador Dove Hidra Liso 400 Ml,Dove,21420
Detergente Líquido Fab Ultra flash 1800 Ml,Fab,33950
Limpia Pisos Ultralimp Lavanda 3 L,Ultralimp,6400
Bolsa de Basura Olimpica Extra Fuertes Mediana X10 Unds,Olimpica,3050
L/PLATO LIQ ULTRA LIMP 500 cm3,Ultralimp,2600
Blanqueador Clorox Original Botella 1.8 lt,Clorox,9450
RECOG TASK C/BANDA CABO METALICO,Task,16900
Jabón Dersa Rey 300 G,Rey,3110
GUANTE TASK COC AFELPADO TAM S M 7.5,Task,14300
Blanqueador UltraLimp Ropa de Color 1000 Ml,Ultralimp,2800
CEP TASK LIMPIA SANITARIO C/BASE,Task,18050
Repelente de insectos Stay OFF! para Niños en Spray 120ml,Stay Off,22500
Detergente Líquido Ariel Doble Poder Concentrado 1200 Ml,Ariel,22690
Repelente Raid para Insectos Voladores Und + Repuesto 65g,Raid,22300
"Detergente Ariel Triple Poder en Polvo 2,2 Kg",Ariel,25990
LIMPIAD ULTRALIMP VINAGRE BICARB 500ML,Ultralimp,4150
ESPONJ TASK SUAVE INOX 3X2 OF,Task,8450
Servilleta Olimpica Blanca X100 Unds,Olimpica,2390
Limpia Pisos Ultralimp Lavanda 1 L,Ultralimp,2350
CEP TASK MANO,Task,8690
PA#O TASK LIMPION ANTIBACT 6X4 un OF,Task,7400
TOALLAS HUM ULTRALIMP DESENG/DESINF 50UN,Ultralimp,4750
FIB ESPONJ TASK LISA 3X2,Task,5690
CEP TASK P/ROPA FIBRA SUAV CLAS,Task,17390
CHUPA TASK BA#O ROJ SUCCION X1un,Task,12550
PAPEL HIGIENICO SUPPRA CARE TRIP HOJ 33 M X4 ROLLO,Suppra Care,5890
BSA BASUR TASK PEQUE#A 50X70 X20UN OF,Task,10400
Toalla de Cocina Familia Practi Diaria X150 Hojas,Familia,9990
BSA BASURA TASK 3 COLORES 70X90 X30un,Task,20600
RPTO TRAPERO TASK ALGODON Ñ24,Task,13000
Repelente de insectos Stay OFF! para Niños en Spray 120ml,Stay Off,22500
Detergente Líquido Ariel Doble Poder Concentrado 1200 Ml,Ariel,22690
Repelente Raid para Insectos Voladores Und + Repuesto 65g,Raid,22300
"Detergente Ariel Triple Poder en Polvo 2,2 Kg",Ariel,25990
BSA BASUR TASK BIO 50X70 X20un OF,Task,8200
TRAPER TASK COPA ALG 280 g C/METAL CLAS,Task,16550
LIMPIADOR ULTRALIMP TEXTILES 500ML,Ultralimp,5150
DESMANCHADOR ULTRALIMP JUNTAS 500ML,Ultralimp,3990
Bolsa de Basura Ultralimp Blanca 65x90 Cm X10 Unds,Ultralimp,2820
LAVALOZA LIQUIDO ULTRALIMP VINAG CITRUS 3.7L,Ultralimp,16600
Limpiavidrios Ultra Limp Brisa Marina 500 Cm3,Ultralimp,2290
Guante Ultra Limp Amarillo Talla 8,Ultra Limp,2490
Suavizante UltraLimp Ropa Manzana 4500 Ml,Ultralimp,13490
Limpia Pisos Fabuloso Antibacterial Lavanda 3L,Fabuloso,25900
Toalla de Papel Reutilizable Scott Duramax 3 Rollos 52H,Duramax,29450
Suavizante UltraLimp Primaveral 1000 Ml,Ultra Limp,3500
Limpiapisos Fabuloso Alternativa al Cloro Bosque de Pino 1L,Fabuloso,10000
Toalla de Papel Reutilizable Scott Duramax 1 Rollo 52H,Duramax,8150
Detergente UltraLimp Polvo Floral 850 G,Ultralimp,3990
